delta.rank,pval,level,nseqs,term,name,p.adj
0,1.89E-06,2,9,GO:0042177,negative regulation of protein catabolic process,0
0,2.07E-06,4,6,GO:0032435;GO:1901799;GO:2000059;GO:1903051;GO:1903363;GO:0007130;GO:0070193,negative regulation of proteasomal protein catabolic process,0
0,2.49E-06,6,34,GO:0032434;GO:2000058,regulation of ubiquitin-dependent protein catabolic process,0
0,5.47E-06,2,63,GO:0042176,regulation of protein catabolic process,0
0,5.63E-06,2,8,GO:0042771;GO:0072332,intrinsic apoptotic signaling pathway by p53 class mediator,0
0,5.63E-06,4,8,GO:0071816;GO:0045048,tail-anchored membrane protein insertion into ER membrane,0
0,6.35E-06,4,48,GO:0090150,establishment of protein localization to membrane,0
0,7.75E-06,5,36,GO:0045665,negative regulation of neuron differentiation,0
0,8.33E-06,3,9,GO:0070059,intrinsic apoptotic signaling pathway in response to endoplasmic reticulum stress,0
0,8.52E-06,2,42,GO:0061136;GO:1903050;GO:1903362,regulation of cellular protein catabolic process,0
0,1.09E-05,3,18,GO:0000381,regulation of alternative mRNA splicing,0
0,1.17E-05,2,10,GO:0070192,chromosome organization involved in meiotic cell cycle,0.004166667
0,1.39E-05,3,14,GO:0031330;GO:0009895,negative regulation of catabolic process,0.003846154
0,1.59E-05,3,11,GO:0008630,intrinsic apoptotic signaling pathway in response to DNA damage,0.006666667
0,1.59E-05,4,11,GO:0045861,negative regulation of proteolysis,0.006666667
0,1.99E-05,2,38,GO:1903046,meiotic cell cycle process,0.009375
0,2.02E-05,2,104,GO:0031329;GO:0009894,regulation of catabolic process,0.008823529
0,2.09E-05,2,12,GO:0051205,protein insertion into membrane,0.008333333
0,4.14E-05,4,15,GO:0030324,lung development,0.0075
0,4.14E-05,5,15,GO:0097193;GO:0097190,intrinsic apoptotic signaling pathway,0.0075
0,5.45E-05,2,18,GO:0010771;GO:0010977;GO:0031345,negative regulation of neuron projection development,0.007142857
0,7.04E-05,2,73,GO:0072657,protein localization to membrane,0.009090909
0,0.000181087,2,25,GO:0072331,signal transduction by p53 class mediator,0.026086957
0,0.000188201,5,9,GO:0061002;GO:0050774;GO:0061000;GO:2000171,negative regulation of dendritic spine morphogenesis,0.027083333
0,0.000228868,6,8,GO:0000245,spliceosomal complex assembly,0.03
0,0.000229545,3,95,GO:0032269;GO:0051248,negative regulation of protein metabolic process,0.032692308
0,0.000258054,2,39,GO:0007420,brain development,0.035185185
0,0.000271514,4,34,GO:0016573;GO:0018393;GO:0018394,internal peptidyl-lysine acetylation,0.035714286
0,0.000279213,3,69,GO:0050768;GO:0010721;GO:0051961,negative regulation of nervous system development,0.034482759
0,0.000332854,4,7,GO:0006620,posttranslational protein targeting to endoplasmic reticulum membrane,0.036666667
0,0.000370122,2,11,GO:0010508,positive regulation of autophagy,0.037096774
0,0.00037271,2,24,GO:0007033,vacuole organization,0.0359375
0,0.000382133,2,273,GO:0022402,cell cycle process,0.036363636
0,0.00049071,3,91,GO:0030162,regulation of proteolysis,0.052941176
0,0.000494162,4,24,GO:0009069,serine family amino acid metabolic process,0.051428571
0,0.000555924,2,88,GO:0051276,chromosome organization,0.058333333
0,0.000556456,2,43,GO:0043648,dicarboxylic acid metabolic process,0.056756757
0,0.00060469,5,13,GO:0061001;GO:0060998;GO:0099175,regulation of dendritic spine development,0.059210526
0,0.000607628,1,324,GO:0022414,reproductive process,0.058974359
0,0.000749068,2,112,GO:0045596,negative regulation of cell differentiation,0.07875
0,0.000781134,2,58,GO:0010769,regulation of cell morphogenesis involved in differentiation,0.081707317
0,0.000785905,7,8,GO:0006544,glycine metabolic process,0.080952381
0,0.000792218,4,95,GO:0007283;GO:0048232,male gamete generation,0.079069767
0,0.000827963,5,11,GO:0051893;GO:0090109;GO:1903391;GO:1901888,regulation of adherens junction organization,0.077272727
0,0.000914514,5,44,GO:0048024;GO:0043484;GO:0050684,regulation of mRNA processing,0.087777778
0,0.0009346,6,15,GO:1905809,negative regulation of synapse organization,0.088043478
0,0.00093796,2,44,GO:0034976,response to endoplasmic reticulum stress,0.086170213
0,0.000946029,5,5,GO:0030422;GO:0070918;GO:0031050,production of small RNA involved in gene silencing by RNA,0.084375
0,0.000988391,3,49,GO:0006475;GO:0006473;GO:0043543,protein acylation,0.089795918
0,0.00114447,3,13,GO:0045047;GO:0072599;GO:0070972,protein targeting to ER,0.104
0,0.001168566,2,16,GO:0010506,regulation of autophagy,0.103921569
0,0.001191688,4,44,GO:0050821;GO:0031647,regulation of protein stability,0.104807692
0,0.001318244,2,14,GO:0042060,wound healing,0.111320755
0,0.001454782,6,4,GO:0045745,positive regulation of G protein-coupled receptor signaling pathway,0.119444444
0,0.001475761,2,128,GO:0010975;GO:0045664;GO:0120035;GO:0031344,regulation of neuron differentiation,0.118181818
0,0.001653329,2,101,GO:0022604,regulation of cell morphogenesis,0.130357143
0,0.001730955,6,60,GO:0031331;GO:0009896,positive regulation of catabolic process,0.135087719
0,0.001794375,2,5,GO:0006020,inositol metabolic process,0.137931034
0,0.001800227,7,26,GO:0006555;GO:0009086;GO:0000097;GO:0009067,aspartate family amino acid biosynthetic process,0.13559322
0,0.001841164,3,126,GO:1901605,alpha-amino acid metabolic process,0.135833333
0,0.001896192,2,17,GO:0001952,regulation of cell-matrix adhesion,0.139344262
0,0.00222072,2,5,GO:0008584,male gonad development,0.160483871
0,0.002274336,2,54,GO:1903311,regulation of mRNA metabolic process,0.16031746
0,0.002370791,3,8,GO:0000278,mitotic cell cycle,0.1640625
0,0.002393367,2,5,GO:0007406;GO:2000647,negative regulation of neuroblast proliferation,0.158208955
0,0.002393367,2,5,GO:0048311,mitochondrion distribution,0.158208955
0,0.002393367,5,5,GO:2000172;GO:0022029;GO:0021885,telencephalon cell migration,0.158208955
0,0.002460736,4,50,GO:0001822,kidney development,0.1625
0,0.002464164,2,133,GO:0048609;GO:0007276,multicellular organismal reproductive process,0.160144928
0,0.002554352,2,60,GO:0022618;GO:0071826,ribonucleoprotein complex subunit organization,0.160714286
0,0.002760623,3,10,GO:0030718,germ-line stem cell population maintenance,0.16971831
0,0.002783206,2,21,GO:0006612,protein targeting to membrane,0.168055556
0,0.002819732,2,93,GO:0051707,response to other organism,0.167123288
0,0.002883561,2,8,GO:0006105,succinate metabolic process,0.168918919
0,0.003023963,4,6,GO:0009258;GO:0009256;GO:0009397;GO:0043649;GO:0042219;GO:0042560,dicarboxylic acid catabolic process,0.171333333
0,0.003269596,4,23,GO:0010810,regulation of cell-substrate adhesion,0.181578947
0,0.003302447,3,54,GO:1901607;GO:0008652,cellular amino acid biosynthetic process,0.181818182
0,0.003362989,2,39,GO:0031396;GO:1903320,regulation of protein modification by small protein conjugation or removal,0.183333333
0,0.003368319,2,33,GO:0009798,axis specification,0.18164557
0,0.003656283,2,40,GO:0050807,regulation of synapse organization,0.195625
0,0.003672158,2,11,GO:0000724;GO:0000725,double-strand break repair via homologous recombination,0.193209877
0,0.003680416,2,40,GO:0045732,positive regulation of protein catabolic process,0.191463415
0,0.00374588,2,4,GO:0031573,intra-S DNA damage checkpoint,0.190963855
0,0.00378077,2,25,GO:0001707,mesoderm formation,0.189880952
0,0.003899017,3,386,GO:0010629;GO:0010605;GO:0009892,negative regulation of metabolic process,0.192352941
0,0.003980547,2,441,GO:0032268;GO:0051246,regulation of protein metabolic process,0.194767442
0,0.004001046,2,76,GO:0018205,peptidyl-lysine modification,0.193678161
0,0.004238676,3,30,GO:0000096,sulfur amino acid metabolic process,0.207954545
0,0.004371037,2,964,GO:0048523;GO:0048519,negative regulation of biological process,0.214606742
0,0.004516377,3,10,GO:0046532;GO:0046533,regulation of photoreceptor cell differentiation,0.219444444
0,0.004544318,3,245,GO:0017144,drug metabolic process,0.218131868
0,0.004560232,2,26,GO:0050773;GO:0048814,regulation of dendrite development,0.216304348
0,0.004588284,6,28,GO:0006893;GO:0098876;GO:0043001;GO:0061951;GO:0072659;GO:1990778,Golgi to plasma membrane transport,0.214516129
0,0.004604425,2,164,GO:0051093,negative regulation of developmental process,0.213297872
0,0.00463715,5,5,GO:0045910,negative regulation of DNA recombination,0.213157895
0,0.004661925,3,562,GO:1901575;GO:0009056;GO:0044248,catabolic process,0.213541667
0,0.004712781,2,23,GO:0031398;GO:1903322,positive regulation of protein modification by small protein conjugation or removal,0.215463918
0,0.004865029,2,25,GO:0008340,determination of adult lifespan,0.218877551
0,0.004897572,2,7,GO:0035640,exploration behavior,0.2155
0,0.004897572,2,7,GO:2000178,negative regulation of neural precursor cell proliferation,0.2155
0,0.004992249,3,165,GO:0050767;GO:0060284;GO:0051960,regulation of nervous system development,0.217326733
0,0.004992666,2,21,GO:0042133,neurotransmitter metabolic process,0.215196078
0,0.005180235,4,37,GO:0006446,regulation of translational initiation,0.219902913
0,0.00522307,4,6,GO:0060047;GO:0003015,heart contraction,0.222115385
0,0.00551104,3,6,GO:0006268,DNA unwinding involved in DNA replication,0.233962264
0,0.00551104,5,6,GO:0007131;GO:0035825,reciprocal meiotic recombination,0.233962264
0,0.005704797,2,12,GO:0031054,pre-miRNA processing,0.239719626
0,0.005838616,4,65,GO:0043065;GO:0043068;GO:0010942,positive regulation of cell death,0.243518519
0,0.00611934,6,31,GO:0006898,receptor-mediated endocytosis,0.25733945
0,0.006320908,4,34,GO:0030177,positive regulation of Wnt signaling pathway,0.263636364
0,0.006367886,2,7,GO:0000018,regulation of DNA recombination,0.262162162
0,0.006446281,2,8,GO:0070997,neuron death,0.263839286
0,0.006496593,4,176,GO:0034613;GO:0070727,cellular macromolecule localization,0.263716814
0,0.006621816,3,35,GO:0001704,formation of primary germ layer,0.265350877
0,0.006852348,4,48,GO:0042742;GO:0009617,response to bacterium,0.275217391
0,0.006925545,2,36,GO:0010632,regulation of epithelial cell migration,0.275
0,0.006981629,3,9,GO:0009109,coenzyme catabolic process,0.273504274
0,0.007068819,2,27,GO:0006302,double-strand break repair,0.274152542
0,0.007124431,2,290,GO:0031324;GO:0051172,negative regulation of cellular metabolic process,0.272689076
0,0.007444319,2,53,GO:0015074,DNA integration,0.282916667
0,0.007676509,4,202,GO:0022603,regulation of anatomical structure morphogenesis,0.284710744
0,0.007888888,2,200,GO:0006520,cellular amino acid metabolic process,0.295081967
0,0.00789808,3,568,GO:0006996,organelle organization,0.292682927
0,0.007967813,2,456,GO:0035556,intracellular signal transduction,0.293145161
0,0.00811663,6,28,GO:0032436;GO:1901800;GO:2000060;GO:1903052;GO:1903364,positive regulation of ubiquitin-dependent protein catabolic process,0.2996
0,0.008181868,4,9,GO:0035564,regulation of kidney size,0.3
0,0.008387415,2,442,GO:0022607,cellular component assembly,0.306692913
0,0.008407275,3,10,GO:0007032,endosome organization,0.3046875
0,0.008554117,4,47,GO:0044272,sulfur compound biosynthetic process,0.307364341
0,0.008675962,5,4,GO:0007367;GO:0007365,segment polarity determination,0.30530303
0,0.008675962,5,4,GO:0035087;GO:0070922,siRNA loading onto RISC involved in RNA interference,0.30530303
0,0.008675962,2,4,GO:0042078,germ-line stem cell division,0.30530303
0,0.008839437,2,10,GO:0051053,negative regulation of DNA metabolic process,0.308646617
0,0.008868625,6,162,GO:0006511;GO:0019941;GO:0043632;GO:0051603,proteolysis involved in cellular protein catabolic process,0.307089552
0,0.009004651,4,392,GO:0051128,regulation of cellular component organization,0.310740741
0,0.009112728,3,43,GO:0009611,response to wounding,0.312132353
0,0.009150156,5,9,GO:0019509;GO:0071267;GO:0043102;GO:0071265,amino acid salvage,0.311678832
0,0.009556678,2,229,GO:0048646,anatomical structure formation involved in morphogenesis,0.32173913
0,0.009631354,4,11,GO:0032508;GO:0032392,DNA geometric change,0.321223022
0,0.009649611,5,4,GO:0006546;GO:0009071,serine family amino acid catabolic process,0.320714286
0,0.009703285,5,101,GO:0051129,negative regulation of cellular component organization,0.320921986
0,0.009743729,4,117,GO:0007186,G protein-coupled receptor signaling pathway,0.320774648
0,0.009894976,2,5,GO:0031623,receptor internalization,0.324475524
0,0.009924301,5,12,GO:0000723;GO:0032200,telomere organization,0.323611111
0,0.010096488,2,10,GO:0051646,mitochondrion localization,0.328275862
0,0.010395415,2,11,GO:0006760;GO:0046653,folic acid-containing compound metabolic process,0.33630137
0,0.010407818,4,12,GO:0044773;GO:0044774,mitotic DNA integrity checkpoint,0.334693878
0,0.010810604,3,55,GO:0098542,defense response to other organism,0.344594595
0,0.010944033,2,56,GO:0007218,neuropeptide signaling pathway,0.345973154
0,0.01123923,8,15,GO:0070536,protein K63-linked deubiquitination,0.357
0,0.011759724,2,6,GO:0021533,cell differentiation in hindbrain,0.368543046
0,0.011837128,2,28,GO:0022904,respiratory electron transport chain,0.36875
0,0.011999573,2,122,GO:0007389,pattern specification process,0.371568627
0,0.012092226,2,16,GO:0002576,platelet degranulation,0.371103896
0,0.012157519,3,423,GO:0019752;GO:0043436;GO:0006082,organic acid metabolic process,0.370322581
0,0.012182531,2,11,GO:0018105;GO:0018209,peptidyl-serine modification,0.368910256
0,0.012407675,4,4,GO:0050931,pigment cell differentiation,0.374840764
0,0.012647471,5,15,GO:0030071;GO:0010965;GO:1902099;GO:0033047;GO:1905818;GO:0033045,regulation of sister chromatid segregation,0.378164557
0,0.012764311,2,6,GO:0007279,pole cell formation,0.380503145
0,0.012851164,4,11,GO:0043046;GO:0034587,piRNA metabolic process,0.38125
0,0.012975653,2,55,GO:0006892,post-Golgi vesicle-mediated transport,0.381987578
0,0.013153183,2,287,GO:0009057;GO:0044265,macromolecule catabolic process,0.383950617
0,0.013445911,3,133,GO:0043207;GO:0009607,response to biotic stimulus,0.390490798
0,0.013588103,3,7,GO:0000045;GO:1905037,autophagosome organization,0.38969697
0,0.013588103,3,7,GO:0050771,negative regulation of axonogenesis,0.38969697
0,0.01382081,4,10,GO:0045124;GO:0046850;GO:0034103,regulation of tissue remodeling,0.393975904
0,0.014152995,3,12,GO:0007040;GO:0080171,lytic vacuole organization,0.399700599
0,0.014228948,5,159,GO:0018193,peptidyl-amino acid modification,0.398809524
0,0.014432611,4,12,GO:0000186,activation of MAPKK activity,0.398529412
0,0.014432611,3,12,GO:0008277,regulation of G protein-coupled receptor signaling pathway,0.398529412
0,0.014897729,3,61,GO:0030111,regulation of Wnt signaling pathway,0.411403509
0,0.015042766,5,20,GO:0050727,regulation of inflammatory response,0.413662791
0,0.015116724,2,41,GO:0032886,regulation of microtubule-based process,0.413294798
0,0.015210503,2,25,GO:0019827;GO:0098727,stem cell population maintenance,0.411206897
0,0.015369956,3,131,GO:1903047,mitotic cell cycle process,0.414
0,0.0154054,2,42,GO:0051187,cofactor catabolic process,0.412784091
0,0.015417272,4,427,GO:0016192,vesicle-mediated transport,0.410734463
0,0.015511895,2,202,GO:0051241,negative regulation of multicellular organismal process,0.412359551
0,0.015617428,2,84,GO:0006310,DNA recombination,0.412011173
0,0.015759751,4,9,GO:0043087;GO:0048013,regulation of GTPase activity,0.413611111
0,0.015846398,5,64,GO:0006605,protein targeting,0.413812155
0,0.016027671,3,17,GO:0043094,cellular metabolic compound salvage,0.415659341
0,0.016098084,2,20,GO:0051983,regulation of chromosome segregation,0.414754098
0,0.016404056,4,7,GO:0042135,neurotransmitter catabolic process,0.420380435
0,0.016461781,2,112,GO:0009790,embryo development,0.42027027
0,0.016515282,2,194,GO:0009605,response to external stimulus,0.419354839
0,0.016748313,5,21,GO:0009411,response to UV,0.42486631
0,0.017138565,5,9,GO:0030516;GO:0061387,regulation of extent of cell growth,0.431382979
0,0.017833082,3,16,GO:0006306;GO:0006305;GO:0044728;GO:0006304,DNA modification,0.447089947
0,0.018009102,4,256,GO:0045595,regulation of cell differentiation,0.448421053
0,0.01801092,2,23,GO:0007093,mitotic cell cycle checkpoint,0.446073298
0,0.018451139,4,11,GO:0090084;GO:0090083,regulation of inclusion body assembly,0.454427083
0,0.018602645,2,9,GO:0017145,stem cell division,0.454404145
0,0.018623788,7,24,GO:0000077;GO:0031570,DNA integrity checkpoint,0.45257732
0,0.018961886,3,28,GO:0045055,regulated exocytosis,0.456923077
0,0.019179073,2,115,GO:0022412,cellular process involved in reproduction in multicellular organism,0.463520408
0,0.019222768,3,48,GO:0001505,regulation of neurotransmitter levels,0.46142132
0,0.019252378,4,57,GO:0042737,drug catabolic process,0.45959596
0,0.019396448,2,14,GO:0060688,regulation of morphogenesis of a branching structure,0.45775
0,0.019396448,4,14,GO:1902692;GO:0072091;GO:2000177,regulation of neural precursor cell proliferation,0.45775
0,0.019509438,3,91,GO:0006790,sulfur compound metabolic process,0.456467662
0,0.019606102,2,6,GO:0071260,cellular response to mechanical stimulus,0.456930693
0,0.020391484,6,27,GO:0033044,regulation of chromosome organization,0.472660099
0,0.021170278,2,51,GO:0016049,cell growth,0.4875
0,0.02124237,2,37,GO:0050770,regulation of axonogenesis,0.486829268
0,0.021275667,2,16,GO:0042558,pteridine-containing compound metabolic process,0.484708738
0,0.02151313,6,29,GO:0007088;GO:0051783,regulation of nuclear division,0.486714976
0,0.021818905,5,127,GO:0045786,negative regulation of cell cycle,0.491105769
0,0.022164092,2,18,GO:0120032;GO:0060491,regulation of plasma membrane bounded cell projection assembly,0.502631579
0,0.022481636,7,5,GO:0006824,cobalt ion transport,0.507619048
0,0.022654421,4,7,GO:0061448;GO:0060612,connective tissue development,0.508530806
0,0.022841979,1,111,GO:0040007,growth,0.511084906
0,0.023416431,4,134,GO:0046394;GO:0016053,carboxylic acid biosynthetic process,0.521126761
0,0.023566248,2,38,GO:0030168,platelet activation,0.521962617
0,0.023656679,2,154,GO:0016055;GO:1905114,Wnt signaling pathway,0.520697674
0,0.023833231,2,13,GO:0021953,central nervous system neuron differentiation,0.522916667
0,0.023842926,3,236,GO:0006281;GO:0006974,cellular response to DNA damage stimulus,0.520506912
0,0.023922076,4,39,GO:0007265,Ras protein signal transduction,0.519266055
0,0.025426052,3,14,GO:0043112,receptor metabolic process,0.549086758
0,0.025643282,2,8,GO:0006534,cysteine metabolic process,0.551136364
0,0.025939827,2,51,GO:0006575,cellular modified amino acid metabolic process,0.554298643
0,0.026046865,2,38,GO:0009416,response to light stimulus,0.553603604
0,0.026073894,2,17,GO:0048640,negative regulation of developmental growth,0.551569507
0,0.026228538,2,14,GO:0045947,negative regulation of translational initiation,0.553348214
0,0.026263804,1,1028,GO:0032501,multicellular organismal process,0.551555556
0,0.02629159,2,426,GO:0007275,multicellular organism development,0.549336283
0,0.026373098,3,5,GO:0001658,branching involved in ureteric bud morphogenesis,0.543231441
0,0.026373098,3,5,GO:0008585,female gonad development,0.543231441
0,0.026373098,2,5,GO:0060563,neuroepithelial cell differentiation,0.543231441
0,0.026383143,5,55,GO:0007050,cell cycle arrest,0.541086957
0,0.026502655,2,39,GO:0071103,DNA conformation change,0.54047619
0,0.027387662,6,41,GO:1901990;GO:1901987,regulation of cell cycle phase transition,0.552155172
0,0.027388985,5,106,GO:0048193,Golgi vesicle transport,0.549785408
0,0.027627607,3,366,GO:0006915;GO:0012501;GO:0008219,cell death,0.55
0,0.027964153,2,28,GO:0031047,gene silencing by RNA,0.552978723
0,0.028272285,4,860,GO:0071702;GO:0071705;GO:0015031;GO:0015833;GO:0045184;GO:0042886;GO:0008104;GO:0033036,organic substance transport,0.556779661
0,0.028651289,3,44,GO:0045930;GO:0010948,negative regulation of mitotic cell cycle,0.558860759
0,0.028974112,2,12,GO:0007205,protein kinase C-activating G protein-coupled receptor signaling pathway,0.56197479
0,0.029056121,2,45,GO:0000075,cell cycle checkpoint,0.560460251
0,0.029201522,3,4,GO:0033700,phospholipid efflux,0.55661157
0,0.029201522,5,4,GO:0050663,cytokine secretion,0.55661157
0,0.029201522,5,4,GO:0065005;GO:0071825,protein-lipid complex assembly,0.55661157
0,0.029209373,3,97,GO:0006066,alcohol metabolic process,0.55204918
0,0.029209373,2,97,GO:0007163,establishment or maintenance of cell polarity,0.55204918
0,0.030020393,2,17,GO:0048675;GO:1990138,axon extension,0.558571429
0,0.030025971,4,5,GO:0042710;GO:0000128;GO:0001403;GO:0036267;GO:0070783;GO:0044182;GO:0030447;GO:0007124,invasive growth in response to glucose limitation,0.556300813
0,0.030093625,2,58,GO:0090287,regulation of cellular response to growth factor stimulus,0.5548583
0,0.03066568,5,28,GO:0006342;GO:0045814;GO:0097549;GO:0034401,chromatin organization involved in regulation of transcription,0.561491935
0,0.030955304,3,16,GO:0007349,cellularization,0.562449799
0,0.030999218,4,32,GO:0009066,aspartate family amino acid metabolic process,0.561
0,0.03117683,4,33,GO:0030182,neuron differentiation,0.561155378
0,0.031343214,3,6,GO:0002067,glandular epithelial cell differentiation,0.562103175
0,0.03162261,3,59,GO:0046395;GO:0016054,organic acid catabolic process,0.565217391
0,0.031733876,2,19,GO:0008406,gonad development,0.56496063
0,0.032477852,2,788,GO:0006950,response to stress,0.573333333
0,0.033489327,2,7,GO:0071108,protein K48-linked deubiquitination,0.5890625
0,0.033501497,2,36,GO:0043414;GO:0032259,macromolecule methylation,0.587159533
0,0.034200982,4,19,GO:0007528,neuromuscular junction development,0.595930233
0,0.034219358,4,57,GO:0046777,protein autophosphorylation,0.594015444
0,0.034271327,1,270,GO:0051704,multi-organism process,0.592115385
0,0.035234917,3,141,GO:0044087,regulation of cellular component biogenesis,0.603256705
0,0.035259098,2,86,GO:0016999,antibiotic metabolic process,0.601145038
0,0.035404807,5,64,GO:0007346,regulation of mitotic cell cycle,0.602661597
0,0.035595469,2,25,GO:0033013,tetrapyrrole metabolic process,0.602840909
0,0.035640056,5,127,GO:0006897;GO:0098657,import into cell,0.600943396
0,0.036149547,4,5,GO:0032365,intracellular lipid transport,0.607518797
0,0.036402495,2,778,GO:0044281,small molecule metabolic process,0.60917603
0,0.036914606,2,7,GO:0006516,glycoprotein catabolic process,0.616044776
0,0.037026903,7,12,GO:0009070,serine family amino acid biosynthetic process,0.615427509
0,0.037155175,2,8,GO:0043152,induction of bacterial agglutination,0.615925926
0,0.03743176,2,37,GO:0040029,regulation of gene expression,
0,0.037597151,6,46,GO:0006099;GO:0006101;GO:0072350,tricarboxylic acid metabolic process,0.618933824
0,0.038329937,2,7,GO:0006930,substrate-dependent cell migration,
0,0.038442016,2,100,GO:0001775,cell activation,0.625182482
0,0.038670607,2,82,GO:0003002,regionalization,0.625272727
0,0.038976658,3,79,GO:0010564,regulation of cell cycle process,0.62826087
0,0.039593788,8,6,GO:0000289,nuclear-transcribed mRNA poly(A) tail shortening,0.63465704
0,0.039670426,3,201,GO:0051186,cofactor metabolic process,0.633273381
0,0.040073845,2,41,GO:0009615,response to virus,0.634767025
0,0.040227732,5,67,GO:0032147,activation of protein kinase activity,0.634642857
0,0.04102256,2,25,GO:0030308,negative regulation of cell growth,0.643950178
0,0.041232641,2,7,GO:0098630,aggregation of unicellular organisms,0.643439716
0,0.042390943,3,14,GO:0071214;GO:0104004,cellular response to abiotic stimulus,0.655123675
0,0.042727291,2,53,GO:0016458,gene silencing,0.657570423
0,0.043285413,4,123,GO:0051270;GO:0040012,regulation of locomotion,0.663508772
0,0.043393774,3,198,GO:0044283,small molecule biosynthetic process,0.662062937
0,0.043468323,2,7,GO:0016180,snRNA processing,0.660801394
0,0.04401792,2,25,GO:0001816,cytokine production,0.665625
0,0.044620026,4,26,GO:0019751,polyol metabolic process,0.670934256
0,0.044855512,2,65,GO:0006887,exocytosis,0.670689655
0,0.04567945,3,9,GO:0051145,smooth muscle cell differentiation,0.679209622
0,0.045891521,2,26,GO:0048813,dendrite morphogenesis,0.679280822
0,0.046323289,2,170,GO:0016567;GO:0032446,protein modification by small protein conjugation,0.682081911
0,0.046546631,3,111,GO:0006417;GO:0010608;GO:0034248,posttranscriptional regulation of gene expression,0.683503401
0,0.047192667,2,75,GO:0048589,developmental growth,0.689661017
0,0.04754764,3,16,GO:0006750;GO:0019184,nonribosomal peptide biosynthetic process,0.690878378
0,0.048345242,2,9,GO:0001778,plasma membrane repair,0.697306397
0,0.048383512,2,108,GO:0032940;GO:0046903,secretion,0.695805369
0,0.049323314,3,32,GO:0048588,developmental cell growth,0.702508361
0,0.050272977,2,10,GO:0002065,columnar/cuboidal epithelial cell differentiation,0.711
0,0.050501147,4,4,GO:0048821;GO:0061515,myeloid cell development,0.711295681
0,0.051491221,2,202,GO:0051726,regulation of cell cycle,0.718211921
0,0.051492663,2,24,GO:0006541,glutamine metabolic process,0.715841584
0,0.051587537,2,221,GO:0042981;GO:0043067;GO:0010941,regulation of cell death,0.714309211
0,0.052504976,3,18,GO:0009612,response to mechanical stimulus,0.723114754
0,0.053346766,2,215,GO:0070647,protein modification by small protein conjugation or removal,0.728921569
0,0.053649182,2,12,GO:0019730;GO:0019731,antimicrobial humoral response,0.729641694
0,0.054414878,2,8,GO:0010591;GO:1902743,regulation of lamellipodium organization,0.735876623
0,0.054444891,5,3396,unknown,unknown,0.733656958
0,0.054588071,3,37,GO:0060560,developmental growth involved in morphogenesis,0.731612903
0,0.055602624,2,6,GO:0032092,positive regulation of protein binding,0.738424437
0,0.056191107,2,8,GO:0015914;GO:0015748,phospholipid transport,0.738498403
0,0.056191107,2,8,GO:0055081,anion homeostasis,0.738498403
0,0.056295541,3,177,GO:0030030,cell projection organization,0.737420382
0,0.05698838,2,738,GO:0065008,regulation of biological quality,0.74015873
